{
  "apiVersion": "guided-test-file.local/v1",
  "id": "mechanics-of-materials-local-practice-01",
  "version": "0.2.0",
  "title": "Mechanics of Materials Local Guided Practice",
  "description": "Three fixed mechanics-of-materials problems using the same local test-file contract as the circuit example. Concepts align to average shear stress, axial deformation and strain, and bilinear shear stress-strain behavior.",
  "formulaSheet": [
    {
      "id": "circular_bolt_area",
      "title": "Circular bolt cross-sectional area",
      "category": "Connection geometry",
      "latex": "A_b = \\frac{\\pi d^2}{4}",
      "inputs": [
        {
          "id": "diameter",
          "name": "Bolt diameter",
          "symbol": "d",
          "unit": "mm",
          "quantityType": "length"
        }
      ],
      "output": {
        "id": "boltArea",
        "name": "Bolt cross-sectional area",
        "symbol": "A_b",
        "unit": "mm^2",
        "quantityType": "area"
      },
      "calculation": {
        "kind": "expression/v1",
        "ast": {
          "op": "divide",
          "args": [
            {
              "op": "multiply",
              "args": [
                {
                  "op": "number",
                  "value": 3.141592653589793
                },
                {
                  "op": "power",
                  "args": [
                    {
                      "op": "slot",
                      "slot": "diameter"
                    },
                    {
                      "op": "number",
                      "value": 2
                    }
                  ]
                }
              ]
            },
            {
              "op": "number",
              "value": 4
            }
          ]
        }
      },
      "teaching": {
        "whatToNotice": "The bolts are circular, and the working shear area is their cross-sectional area at a shear plane.",
        "whyThisOperation": "Diameter is given, so the circle-area relationship produces the area of one bolt at one shear plane.",
        "commonMistakes": [
          "Using pi times d squared instead of pi d squared divided by four.",
          "Forgetting that the diameter is squared."
        ]
      }
    },
    {
      "id": "effective_multi_plane_shear_area",
      "title": "Effective area for multiple bolts and shear planes",
      "category": "Connection geometry",
      "latex": "A_{eff} = n N_p A_b",
      "inputs": [
        {
          "id": "boltCount",
          "name": "Number of bolts",
          "symbol": "n",
          "unit": "count",
          "quantityType": "count"
        },
        {
          "id": "shearPlanes",
          "name": "Shear planes per bolt",
          "symbol": "N_p",
          "unit": "count",
          "quantityType": "count"
        },
        {
          "id": "boltArea",
          "name": "Area of one bolt",
          "symbol": "A_b",
          "unit": "mm^2",
          "quantityType": "area"
        }
      ],
      "output": {
        "id": "effectiveShearArea",
        "name": "Effective shear area",
        "symbol": "A_{eff}",
        "unit": "mm^2",
        "quantityType": "area"
      },
      "calculation": {
        "kind": "expression/v1",
        "ast": {
          "op": "multiply",
          "args": [
            {
              "op": "slot",
              "slot": "boltCount"
            },
            {
              "op": "multiply",
              "args": [
                {
                  "op": "slot",
                  "slot": "shearPlanes"
                },
                {
                  "op": "slot",
                  "slot": "boltArea"
                }
              ]
            }
          ]
        }
      },
      "teaching": {
        "whatToNotice": "The connection has several bolts, and a double-lap joint places two shear planes through each bolt.",
        "whyThisOperation": "The load is shared across every stated bolt and every stated shear plane under the equal-load-sharing assumption.",
        "commonMistakes": [
          "Counting the bolts but forgetting the second shear plane.",
          "Doubling the bolt diameter instead of doubling the number of shear planes."
        ]
      }
    },
    {
      "id": "average_shear_stress",
      "title": "Average shear stress",
      "category": "Average stress",
      "latex": "\\tau_{avg} = \\frac{V}{A_{eff}}",
      "inputs": [
        {
          "id": "shearLoad",
          "name": "Applied shear load",
          "symbol": "V",
          "unit": "N",
          "quantityType": "force"
        },
        {
          "id": "effectiveShearArea",
          "name": "Effective shear area",
          "symbol": "A_{eff}",
          "unit": "mm^2",
          "quantityType": "area"
        }
      ],
      "output": {
        "id": "averageShearStress",
        "name": "Average shear stress",
        "symbol": "\\tau_{avg}",
        "unit": "MPa",
        "quantityType": "stress"
      },
      "calculation": {
        "kind": "expression/v1",
        "ast": {
          "op": "divide",
          "args": [
            {
              "op": "slot",
              "slot": "shearLoad"
            },
            {
              "op": "slot",
              "slot": "effectiveShearArea"
            }
          ]
        }
      },
      "teaching": {
        "whatToNotice": "The load acts to slide the connected plates across the bolt shanks.",
        "whyThisOperation": "Average shear stress is the applied shear force divided by the total area resisting that shear. N per square millimetre is MPa.",
        "commonMistakes": [
          "Dividing by only one bolt area.",
          "Using the unconverted load in kilonewtons with square millimetres."
        ]
      }
    },
    {
      "id": "axial_deformation",
      "title": "Axial deformation of a prismatic bar",
      "category": "Axial loading",
      "latex": "\\delta = \\frac{P L}{A E}",
      "inputs": [
        {
          "id": "axialLoad",
          "name": "Axial load",
          "symbol": "P",
          "unit": "N",
          "quantityType": "force"
        },
        {
          "id": "barLength",
          "name": "Original bar length",
          "symbol": "L",
          "unit": "mm",
          "quantityType": "length"
        },
        {
          "id": "barArea",
          "name": "Cross-sectional area",
          "symbol": "A",
          "unit": "mm^2",
          "quantityType": "area"
        },
        {
          "id": "elasticModulus",
          "name": "Elastic modulus",
          "symbol": "E",
          "unit": "MPa",
          "quantityType": "modulus"
        }
      ],
      "output": {
        "id": "axialDeformation",
        "name": "Axial elongation",
        "symbol": "\\delta",
        "unit": "mm",
        "quantityType": "deformation"
      },
      "calculation": {
        "kind": "expression/v1",
        "ast": {
          "op": "divide",
          "args": [
            {
              "op": "multiply",
              "args": [
                {
                  "op": "slot",
                  "slot": "axialLoad"
                },
                {
                  "op": "slot",
                  "slot": "barLength"
                }
              ]
            },
            {
              "op": "multiply",
              "args": [
                {
                  "op": "slot",
                  "slot": "barArea"
                },
                {
                  "op": "slot",
                  "slot": "elasticModulus"
                }
              ]
            }
          ]
        }
      },
      "teaching": {
        "whatToNotice": "The member is straight, prismatic, and loaded along its axis.",
        "whyThisOperation": "For a uniform elastic bar, load and length increase deformation while area and modulus reduce it.",
        "commonMistakes": [
          "Using metres with square millimetres and MPa without converting.",
          "Putting E in the numerator."
        ]
      }
    },
    {
      "id": "normal_strain_from_deformation",
      "title": "Normal strain from elongation",
      "category": "Strain",
      "latex": "\\epsilon = \\frac{\\delta}{L}",
      "inputs": [
        {
          "id": "deformation",
          "name": "Axial deformation",
          "symbol": "\\delta",
          "unit": "mm",
          "quantityType": "deformation"
        },
        {
          "id": "originalLength",
          "name": "Original length",
          "symbol": "L",
          "unit": "mm",
          "quantityType": "length"
        }
      ],
      "output": {
        "id": "normalStrain",
        "name": "Normal strain",
        "symbol": "\\epsilon",
        "unit": "mm/mm",
        "quantityType": "strain"
      },
      "calculation": {
        "kind": "expression/v1",
        "ast": {
          "op": "divide",
          "args": [
            {
              "op": "slot",
              "slot": "deformation"
            },
            {
              "op": "slot",
              "slot": "originalLength"
            }
          ]
        }
      },
      "teaching": {
        "whatToNotice": "Strain is a normalized change in length, so it compares elongation to the original length.",
        "whyThisOperation": "Dividing delta by L removes length units and produces dimensionless normal strain.",
        "commonMistakes": [
          "Dividing the original length by the elongation.",
          "Reporting millimetres as the unit of strain."
        ]
      }
    },
    {
      "id": "elastic_shear_strain",
      "title": "Elastic shear strain",
      "category": "Shear stress strain",
      "latex": "\\gamma = \\frac{\\tau}{G}",
      "inputs": [
        {
          "id": "shearStress",
          "name": "Shear stress",
          "symbol": "\\tau",
          "unit": "MPa",
          "quantityType": "stress"
        },
        {
          "id": "shearModulus",